{
  "$schema": "https://json-schema.org/draft/2020-12/schema",
  "$id": "https://github.com/crypta-network/cryptad/tools/release-certification/schemas/stable-1.0-vulnerability-ledger-tip-anchor-v1.schema.json",
  "title": "Cryptad Stable 1.0 vulnerability durable ledger-tip anchor v1",
  "type": "object",
  "additionalProperties": false,
  "required": [
    "schemaVersion",
    "kind",
    "repositoryIdentity",
    "stableMilestone",
    "policyDigest",
    "initialized",
    "anchorSequence",
    "previousAnchorDigest",
    "ledgerEdition",
    "ledgerDigest",
    "producerWorkflow",
    "workflowCommit",
    "runId",
    "runAttempt",
    "artifactName",
    "artifactDigest",
    "successorBindingDigest",
    "activatedAt",
    "anchorDigest"
  ],
  "properties": {
    "schemaVersion": {
      "const": "1"
    },
    "kind": {
      "const": "stable-1.0-vulnerability-ledger-tip-anchor"
    },
    "repositoryIdentity": {
      "const": "github.com/crypta-network/cryptad"
    },
    "stableMilestone": {
      "const": "1.0"
    },
    "policyDigest": {
      "$ref": "stable-1.0-vulnerability-common-v1.schema.json#/$defs/digest"
    },
    "initialized": {
      "type": "boolean"
    },
    "anchorSequence": {
      "type": "string",
      "pattern": "^(0|[1-9][0-9]{0,9})$"
    },
    "previousAnchorDigest": {
      "$ref": "stable-1.0-vulnerability-common-v1.schema.json#/$defs/nullableDigest"
    },
    "ledgerEdition": {
      "type": "string",
      "pattern": "^(0|[1-9][0-9]{0,9})$"
    },
    "ledgerDigest": {
      "$ref": "stable-1.0-vulnerability-common-v1.schema.json#/$defs/digest"
    },
    "producerWorkflow": {
      "oneOf": [
        {
          "enum": [
            ".github/workflows/stable-1.0-vulnerability-intake.yml",
            ".github/workflows/stable-1.0-vulnerability-triage-authorization.yml",
            ".github/workflows/stable-1.0-vulnerability-disclosure-authorization.yml",
            ".github/workflows/stable-1.0-vulnerability-disclosure-publication.yml"
          ]
        },
        {
          "type": "null"
        }
      ]
    },
    "workflowCommit": {
      "oneOf": [
        {
          "type": "string",
          "pattern": "^[0-9a-f]{40}$"
        },
        {
          "type": "null"
        }
      ]
    },
    "runId": {
      "oneOf": [
        {
          "type": "string",
          "pattern": "^[1-9][0-9]*$",
          "maxLength": 32
        },
        {
          "type": "null"
        }
      ]
    },
    "runAttempt": {
      "oneOf": [
        {
          "type": "string",
          "pattern": "^[1-9][0-9]*$",
          "maxLength": 16
        },
        {
          "type": "null"
        }
      ]
    },
    "artifactName": {
      "oneOf": [
        {
          "type": "string",
          "pattern": "^[A-Za-z0-9][A-Za-z0-9._-]{0,255}$"
        },
        {
          "type": "null"
        }
      ]
    },
    "artifactDigest": {
      "$ref": "stable-1.0-vulnerability-common-v1.schema.json#/$defs/nullableDigest"
    },
    "successorBindingDigest": {
      "$ref": "stable-1.0-vulnerability-common-v1.schema.json#/$defs/nullableDigest"
    },
    "activatedAt": {
      "$ref": "stable-1.0-vulnerability-common-v1.schema.json#/$defs/nullableTimestamp"
    },
    "anchorDigest": {
      "$ref": "stable-1.0-vulnerability-common-v1.schema.json#/$defs/digest"
    }
  }
}
