{
  "activatedAt": null,
  "anchorDigest": "sha256:82053410f5378881db52363b74f07eca9c46bc8ec42f957759afdd6d79eaf3ea",
  "anchorSequence": "0",
  "artifactDigest": null,
  "artifactName": null,
  "initialized": false,
  "kind": "stable-1.0-vulnerability-ledger-tip-anchor",
  "ledgerDigest": "sha256:49515fbe8e365fe35ca09363dbe0aebda3b9275faba6c03e928c6982ba577ee5",
  "ledgerEdition": "0",
  "policyDigest": "sha256:91057e20ea818cffeef97a582d61a87f5e7ca29a3660ca1b77298ac9a5399e08",
  "previousAnchorDigest": null,
  "producerWorkflow": null,
  "repositoryIdentity": "github.com/crypta-network/cryptad",
  "runAttempt": null,
  "runId": null,
  "schemaVersion": "1",
  "stableMilestone": "1.0",
  "successorBindingDigest": null,
  "workflowCommit": null
}
